title,company,location,posted_time,description,link
DevOps Build and Release,EJR Search Partners,"New York, NY",3 days ago,"As a DevOps Engineer, you will be part of team responsible for establishing and maintaining the Continuous Integration (CI) and",https://www.dice.com/jobs/detail/DevOps-Build-and-Release-EJR-Search-Partners-New-York-NY-10001/10465180/6318153
AWS SECURITY SOFTWARE ENGINEER,Corporate Consulting Services,"New York, NY",3 days ago,NO 3RD PARTY The team has a position open for a Senior Security Software Engineer requires expertise in modern software,https://www.dice.com/jobs/detail/AWS-SECURITY-SOFTWARE-ENGINEER-Corporate-Consulting-Services-New-York-NY-10001/10105946/3403
DevOps Engineer,Norgate Technology Inc,"New York, NY",3 days ago,"Sponosorship not available Position Responsibilities: Puppet, Chef, or Ansible Automation (Orchestrate system provisioning, scaling...",https://www.dice.com/jobs/detail/DevOps-Engineer-Norgate-Technology-Inc-New-York-NY-11753/norny001/062217%26%23453
Angular Developer,Telecomm Software,"New York, NY",3 days ago,ANGULAR Expert Needed for Enterprise Data & Analytics group that develops and operates a set of front-to-back applications that...,https://www.dice.com/jobs/detail/Angular-Developer-Telecomm-Software-New-York-NY-10001/10170977/447%26%2345MH988
Data Engineer,International Solutions Group,"Nyc, NY",3 days ago,Roles & Responsibilities Build & deploy large-scale ETL and stream processing pipelines in our serverless microservice...,https://www.dice.com/jobs/detail/Data-Engineer-International-Solutions-Group-Nyc-NY-10001/10120894/GV%26%234520201
Director of Data Science,CyberCoders,"New York City, NY",2 days ago,"Minimum Required Skills: Machine Learning, Statistics, Management, analytics team management, Data Science, goal setting and follow...",https://www.dice.com/jobs/detail/Director-of-Data-Science-CyberCoders-New-York-City-NY-10001/cybercod/RS2%26%23451546738113
Software Engineer (Relocation to...,CyberCoders,"New York, NY",2 days ago,"Minimum Required Skills: C++, Frostbite, Actionscript, SQL If you are an experienced Software Engineer and looking to relocate to the",https://www.dice.com/jobs/detail/Software-Engineer-%28Relocation-to-Eugene%2C-OR-area%29-CyberCoders-New-York-NY-10001/cybercod/JG9%26%23451561558102
Senior Systems Administrator,CyberCoders,"New York, NY",2 days ago,"Minimum Required Skills: Systems Administrator, Linux/Solaris, VMWare ESXi, vSphere, VERITAS cluster server, EMC PowerPath, SSO...",https://www.dice.com/jobs/detail/Senior-Systems-Administrator-CyberCoders-New-York-NY-10001/cybercod/AT%26%23451547354113
Reliability Engineer - M,Next Step Systems,"New York, NY",23 hours ago,"Reliability Engineer As a member of this versatile group of Full Stack Engineers, the Reliability Engineer will be on the",https://www.dice.com/jobs/detail/Reliability-Engineer-%26%2345-M-Next-Step-Systems-New-York-NY-10001/NEXIL001/6330061
Sr React Engineer,Ubergig,"New York, NY",15 hours ago,What we re looking for 3+ years of experience with production React development 5+ years with production JavaScript development...,https://www.dice.com/jobs/detail/Sr-React-Engineer-Ubergig-New-York-NY-10001/10368514/6332119
AWS Solution Architect (Remote)...,Tephra Inc.,"Edison, NJ",15 hours ago,"10-12 years of overall IT experience in architecting, designing and building enterprise systems with minimum 3 in architecting,...",https://www.dice.com/jobs/detail/AWS-Solution-Architect-%28Remote%29-with-60%26%234580%26%2337-travel-Tephra-Inc.-Edison-NJ-08817/10462853/AWSSARNJ
Back Office Developer,Gotham Technology,"New York, NY",19 hours ago,Large institutional alternative asset manager client of ours in Midtown Manhattan has hired us to introduce them to their next,https://www.dice.com/jobs/detail/Back-Office-Developer-Gotham-Technology-New-York-NY-10001/10486491/NW%26%2345BODev
Network Security Engineer,Gotham Technology,"New York, NY",19 hours ago,"Our client, a global asset management firm is looking to hire a Network Security Engineer to work full-time at their",https://www.dice.com/jobs/detail/Network-Security-Engineer-Gotham-Technology-New-York-NY-10001/10486491/ER%26%2345NNSE
Senior IT Security Analyst,AMS Staffing Inc.,"New York, NY",12 hours ago,Please send resume in Word format if you are interested in this Senior IT Security Analyst role with our client,https://www.dice.com/jobs/detail/Senior-IT-Security-Analyst-AMS-Staffing-Inc.-New-York-NY-10001/10192616/6333420
Entry level Java developer,ConsultAdd,"New York, NY",2 weeks ago,Job Summary: Looking for a Jr.Java developer or Entry level Java developer in our technical team who will be responsible,https://www.dice.com/jobs/detail/Entry-level-Java-developer-ConsultAdd-New-York-NY-10001/10504871/6339087
Senior Database Administrator -...,Kforce Technology Staffing,"New York, NY",11 hours ago,"RESPONSIBILITIES: Kforce is working with a growing Gaming Firm located in New York, New York (NY). A firm that is",https://www.dice.com/jobs/detail/Senior-Database-Administrator-%26%2345-Cassandra-Kforce-Technology-Staffing-New-York-NY-10001/kforcecx/ITAQG1787313
Summit (Fixed Income) Business...,The Caldwell Group,"Nyc, NY",10 hours ago,"Responsibilities: For all that relates to Fixed Income, Treasury and Credit business: Project Management / Business Analysis:...",https://www.dice.com/jobs/detail/Summit-%28Fixed-Income%29-Business-Analyst-%26%2347-IT-The-Caldwell-Group-Nyc-NY-10001/caldwell/6327493
Cloud Data Architect,Kforce Technology Staffing,"New York, NY",11 hours ago,"RESPONSIBILITIES: Kforce is working with a growing technology firm (a startup within a larger organization), and they are searching...",https://www.dice.com/jobs/detail/Cloud-Data-Architect-Kforce-Technology-Staffing-New-York-NY-10005/kforcecx/ITAQG1831540
Senior Data Engineer - Remote,Kforce Technology Staffing,"New York, NY",11 hours ago,"RESPONSIBILITIES: Kforce has a client, a healthcare startup (a fast growing firm) in New York, NY that is seeking a",https://www.dice.com/jobs/detail/Senior-Data-Engineer-%26%2345-Remote-Kforce-Technology-Staffing-New-York-NY-10018/kforcecx/ITAQG1845222
Senior Build Systems Engineer -...,Kforce Technology Staffing,"New York, NY",11 hours ago,"RESPONSIBILITIES: Kforce has a client in search of a Senior Build Systems Engineer - CI/CD in New York, NY. Summary:",https://www.dice.com/jobs/detail/Senior-Build-Systems-Engineer-%26%2345-CI%26%2347CD-Kforce-Technology-Staffing-New-York-NY-10001/kforcecx/ITAQG1865998
Data Scientist,Kforce Technology Staffing,"New York, NY",11 hours ago,"RESPONSIBILITIES: Kforce is working with a growing healthcare tech client that is hiring a Data Scientist in New York, NY.",https://www.dice.com/jobs/detail/Data-Scientist-Kforce-Technology-Staffing-New-York-NY-10036/kforcecx/ITAQG1866671
Data Engineer,Kforce Technology Staffing,"New York, NY",11 hours ago,"RESPONSIBILITIES: Kforce's client, a leading entertainment company in NYC, New York (NY) is seeking a Data Engineer. They are offering",https://www.dice.com/jobs/detail/Data-Engineer-Kforce-Technology-Staffing-New-York-NY-10121/kforcecx/ITAQG1783043
Senior DevOps Engineer,Kforce Technology Staffing,"New York, NY",11 hours ago,RESPONSIBILITIES: Kforce has a Healthcare Startup client that is seeking a Senior DevOps Engineer. This is a 100% remote role.,https://www.dice.com/jobs/detail/Senior-DevOps-Engineer-Kforce-Technology-Staffing-New-York-NY-10018/kforcecx/ITAQG1862061
Data Engineer,Kforce Technology Staffing,"New Hyde Park, NY",11 hours ago,"RESPONSIBILITIES: Kforce has a client in New Hyde Park, New York (NY) and they are seeking a Data Engineer. Summary:",https://www.dice.com/jobs/detail/Data-Engineer-Kforce-Technology-Staffing-New-Hyde-Park-NY-11040/kforcecx/ITAQG1815427
Boomi / ETL Developer,Velocity Technology Resources,"New York, NY",moments ago,"Our client a leading health care services company located in midtown, NYC is looking for an ETL developer with Boomi",https://www.dice.com/jobs/detail/Boomi-%26%2347-ETL-Developer-Velocity-Technology-Resources-New-York-NY-10017/80108439/19%26%234500051
Java Developer,Collabera,"New York, NY",9 hours ago,"New York, New York Skills : Java ,SOAP ,Restful ,webservices ,spring Description : Job Description/ Roles & Responsibilities...",https://www.dice.com/jobs/detail/Java-Developer-Collabera-New-York-NY-10001/gciow/225204
Application Support,Collabera,"New York, NY",9 hours ago,"New York, New York Skills : Production support,application support,Java,Unix ,Linux Description : Job Description/ Roles &...",https://www.dice.com/jobs/detail/Application-Support-Collabera-New-York-NY-10003/gciow/225193
Senior Network Engineer,Xoriant Corporation,"New York, NY",moments ago,"Candidate can work from either client location: Irving, TX/ Jersey City, NJ/New York, NY/ Tampa, FL/ MN Flexible hours, working",https://www.dice.com/jobs/detail/Senior-Network-Engineer-Xoriant-Corporation-New-York-NY-10001/xorca001/6252424
Junior Hadoop / Big Data Developer,Orgspire Inc,"Jersey City, NJ",17 minutes ago,"Junior Hadoop Developer Location: Jersey City, NJ Full Time Wanted 1 -2 years of experience working on Hadoop eco system.",https://www.dice.com/jobs/detail/Junior-Hadoop-%26%2347-Big-Data-Developer-Orgspire-Inc-Jersey-City-NJ-07097/10210953/2019%26%23454605
Java Developer,Infosys Technologies Ltd,"Jersey City, NJ",2 hours ago,Infosys is a global leader in next-generation digital services and consulting. We navigate our clients digital transformations in 45...,https://www.dice.com/jobs/detail/Java-Developer-Infosys-Technologies-Ltd-Jersey-City-NJ-07097/10204393/52159BR
Site Reliability Engineers,"Endure Technology Solutions, Inc.","New York, NY",13 minutes ago,"""Those authorized to work in the United States without sponsorship are encouraged to apply.s and those authorized to work in",https://www.dice.com/jobs/detail/Site-Reliability-Engineers-Endure-Technology-Solutions%2C-Inc.-New-York-NY-10001/10427070/JOB%26%23451692
Blockchain Engineer (Solidity),"Endure Technology Solutions, Inc.","New York, NY",14 minutes ago,Blockchain Engineer (Solidity) NEW YORK CITY FULL-TIME Relevant Skills and Experience: Smart contract development experience...,https://www.dice.com/jobs/detail/Blockchain-Engineer-%28Solidity%29-Endure-Technology-Solutions%2C-Inc.-New-York-NY-10001/10427070/JOB%26%23451673
DevOps Engineer,"Hired by Matrix, Inc.","New York, NY",7 minutes ago,"Job Summary Our Client is seeking a STRONG DevOps Engineer to support the development lifecycle, cloud deployment and release...",https://www.dice.com/jobs/detail/DevOps-Engineer-Hired-by-Matrix%2C-Inc.-New-York-NY-10008/mic/BBBH31028%26%2345482
Junior System Engineer,Gambit Technologies Inc,"New York, NY",1 day ago,Summary: Top NYC Hedge fund is looking for a Junior Systems Engineers to join a team supporting users and automating,https://www.dice.com/jobs/detail/Junior-System-Engineer-Gambit-Technologies-Inc-New-York-NY-10001/10116662/JS4270491227
Application Support Engineer,Gambit Technologies Inc,"New York, NY",1 day ago,Application Support Engineer Summary: World leading quantitative hedge fund in New York City is looking for creative problem solvers...,https://www.dice.com/jobs/detail/Application-Support-Engineer-Gambit-Technologies-Inc-New-York-NY-10001/10116662/JS243893832
DevOps Engineer- In-person...,Techtriad Team - T3,"New York, NY",2 weeks ago,"Position Summary: Implement and support AWS-based Kafka clusters and Mongo DB instances, including release automation and deployment,...",https://www.dice.com/jobs/detail/DevOps-Engineer%26%2345-In%26%2345person-Mandatory-Techtriad-Team-%26%2345-T3-New-York-NY-10001/90995670/6331939
.Net Developers,"Mitchell Martin, Inc.","Montvale, NJ",3 weeks ago,"Coding, testing and debugging programs according to computer engineering specifications Modifying, expanding and updating applications...",https://www.dice.com/jobs/detail/.Net-Developers-Mitchell-Martin%2C-Inc.-Montvale-NJ-07645/mitchmar4/6331299
Azure Developer,Net2Source Inc.,"Armonk, NY",3 weeks ago,"My name is Kushagra, and I am a recruiter with Net2Source Inc. Net2Source Inc. is one of the fastest growing",https://www.dice.com/jobs/detail/Azure-Developer-Net2Source-Inc.-Armonk-NY-10504/10271304/6305311
Senior Java Full stack Developer,"Niit Technologies, Inc.","New York, NY",3 weeks ago,"We at NIIT Technologies are currently seeking a Sr. Java Full stack developer for a long-term opportunity in Oaks, PA.",https://www.dice.com/jobs/detail/Senior-Java-Full-stack-Developer-Niit-Technologies%2C-Inc.-New-York-NY-10001/RTL036009/6333746
Java ELR/ECR...,BrickLogix,"Long Island City, NY",3 weeks ago,"Email resume to HR at bricklogix.com Role: ELR/ECR Java Software Development Location: 28th St, Long Island City, NY 11101 Duration:",https://www.dice.com/jobs/detail/Java-ELR%26%2347ECR-Developer%28Java%2CAnt%2CTomcat%2Clog4j%2CHibernate%2CSQL%2CMaven%2CElectronic-Lab%26%2347Case-Reporting%2Cpublic-health-surveillance-informatics%26%2347electronic-case-reporting%2CValidate%26%2347parse%26%2347storing-HL7-messages-based-on-CDA-R2%26%2347FHIR%29-BrickLogix-Long-Island-City-NY-11101/10409520/6338908
Development Build Engineer CI/CD,"Tekmark Global Solutions, LLC","Middletown, NJ",2 weeks ago,Job Description: -Client is seeking a Development Build Engineer CI/CD or Software build and release support engineer...,https://www.dice.com/jobs/detail/Development-Build-Engineer-CI%26%2347CD-Tekmark-Global-Solutions%2C-LLC-Middletown-NJ-07748/tgsnj/138963
.Net developer,Vedasoft Inc,"New York, NY",2 weeks ago,"Overall 7+ years of development experience Minimum 6+ years of hands-on experience in web development using .Net 4.0 and above,",https://www.dice.com/jobs/detail/.Net-developer-Vedasoft-Inc-New-York-NY-10001/10278242/6330742
Data Scientist,Net2Source Inc.,"Union Beach, NJ",3 weeks ago,"Net2Source is a Global Workforce Solutions Company headquartered at NJ, USA with its branch offices in Asia Pacific Region. We",https://www.dice.com/jobs/detail/Data-Scientist-Net2Source-Inc.-Union-Beach-NJ-07735/10271304/6334498
ELK Stack Sr. Developer,Park Intelli Solutions Private Ltd,"Hoboken, NJ",2 weeks ago,"Hi Associates, Hope you're doing well. I was wondering if you would be interested in learning more about an opportunity",https://www.dice.com/jobs/detail/ELK-Stack-Sr.-Developer-Park-Intelli-Solutions-Private-Ltd-Hoboken-NJ-07030/91098651/6334561
ELK Stack Consultant,"Next Level Business Services, Inc.","Hoboken, NJ",2 weeks ago,"Role: ELK Stack Consultant Location: Hoboken, NJ Job Description:. Design and implement highly scalable ELK (Elastic Search, Logstash...",https://www.dice.com/jobs/detail/ELK-Stack-Consultant-Next-Level-Business-Services%2C-Inc.-Hoboken-NJ-07030/10360765/6334708
Fullstack Node.js/React Developer,"SilverSearch, Inc.","Livingston, NJ",3 weeks ago,"Senior NodeJS Developer for Livingston, NJ Financial client. Long term contract! Phone interview first, then will hire over video-must...",https://www.dice.com/jobs/detail/Fullstack-Node.js%26%2347React-Developer-SilverSearch%2C-Inc.-Livingston-NJ-07039/10112164/AH%26%2345NodeRNJ
Azure Administrator,Luxoft USA Inc,"Weehawken, NJ",2 weeks ago,Job Description: The Microsoft Azure Platform Support (MAPS) team is a dedicated function that resides under the Technology Operation...,https://www.dice.com/jobs/detail/Azure-Administrator-Luxoft-USA-Inc-Weehawken-NJ-07086/newageny/6315284
Full stack developer with...,Expedite Technology Solutions,"Franklin Lakes, NJ",2 weeks ago,We are looking for a full stack developer to produce scalable software solutions. You ll be part of a cross-functional,https://www.dice.com/jobs/detail/Full-stack-developer-with-springboot-Expedite-Technology-Solutions-Franklin-Lakes-NJ-07417/10317972/ACP05
Network Security Architect/,Knowledge Builders Inc,"Nyc, NY",2 weeks ago,Configure and maintain heterogeneous Splunk environments and in-depth knowledge of log analysis generated by various systems including...,https://www.dice.com/jobs/detail/Network-Security-Architect%26%2347-Knowledge-Builders-Inc-Nyc-NY-10001/10282707/6336512
Senior Software Engineer,Flexton Inc,"North Hills, NY",2 weeks ago,"Experience implementing API and integration technologies in a distributed, server-based enterprise-class environment using a...",https://www.dice.com/jobs/detail/Senior-Software-Engineer-Flexton-Inc-North-Hills-NY-11040/10282686/poosoftengg
java developer,StoneGate-Technologies LLC,"New York, NY",2 weeks ago,"Hi, Hope you are doing well!! Please go through the below job description and let me know your interest and",https://www.dice.com/jobs/detail/java-developer-StoneGate%26%2345Technologies-LLC-New-York-NY-10001/91093695/6337533
Data Scientist,InfoPeople Corp,"Jericho, NY",2 weeks ago,"InfoPeople Corporation is currently seeking a Data Scientist with our direct client in their NYC , NY location. This is",https://www.dice.com/jobs/detail/Data-Scientist-InfoPeople-Corp-Jericho-NY-11753/10186340/6317468
Data Scientist,Reliable Software Resources,"New York, NY",2 weeks ago,"Hi , Please find below JD and let me know for your interest Job title :Data Scientist Location : NYC",https://www.dice.com/jobs/detail/Data-Scientist-Reliable-Software-Resources-New-York-NY-10001/10122703/6336400
Systems Engineer,First Tier Technology LLC.,"New York, NY",2 weeks ago,"We re looking for a talented Systems Engineer for our direct client, a leading global financial institution, located in Midtown",https://www.dice.com/jobs/detail/Systems-Engineer-First-Tier-Technology-LLC.-New-York-NY-10001/10125679/6334971
Azure Data Engineer,"Pyramid Consulting, Inc.","Warren, NJ",1 week ago,Our client is in immediate need for a talented Azure Data Engineer ; with experience in the IT Industry. This,https://www.dice.com/jobs/detail/Azure-Data-Engineer-Pyramid-Consulting%2C-Inc.-Warren-NJ-07059/pyrmid/6339914
azure data engineer,3R Info LLC,"Warren, NJ",1 week ago,"Location: Warren, NJ Data Engineer Role: azure data engineer Responsibilities: Designing, implementing, and delivering batch data...",https://www.dice.com/jobs/detail/azure-data-engineer-3R-Info-LLC-Warren-NJ-07059/90799990/6340311
AWS DevOps SRE,United Business Solutions Inc,"Roseland, NJ",1 week ago,"Role: AWS DevOps SRE Location: Roseland, NJ Duration: Long Term USC and GC only Description Our client is seeking an",https://www.dice.com/jobs/detail/AWS-DevOps-SRE-United-Business-Solutions-Inc-Roseland-NJ-07068/10493171/6340271
Remote::::Azure Cloud Developer,REDLEO SOFTWARE INC.,"New York, NY",1 week ago,"Azure Cloud Developer REMOTE 6 month right to hire Must have active LinkedIn profiles when sending the resume, please send",https://www.dice.com/jobs/detail/Remote%3A%3A%3A%3AAzure-Cloud-Developer-REDLEO-SOFTWARE-INC.-New-York-NY-10001/91088682/6340696
Senior Middleware Operations...,SPECTRAFORCE TECHNOLOGIES Inc.,"Jersey City, NJ",1 week ago,Job Title: Senior Middleware Operations Engineer role Location: Jersey City - preferred. Open to South lake and Omaha Duration: 6,https://www.dice.com/jobs/detail/Senior-Middleware-Operations-Engineer-SPECTRAFORCE-TECHNOLOGIES-Inc.-Jersey-City-NJ-07097/10119021/Middleware
Azure Data Engineer,"Pyramid Consulting, Inc.","Warren, NJ",1 week ago,Our client is in immediate need for a talented Azure Data Engineer ; with experience in the IT Industry. This,https://www.dice.com/jobs/detail/Azure-Data-Engineer-Pyramid-Consulting%2C-Inc.-Warren-NJ-07059/pyrmid/6325328
Google Cloud Platform (GCP)...,"TechnoSphere, Inc","New York, NY",1 week ago,"Our client, a financial services firm in New York City is looking for a Google Cloud Platform (GCP) Architect. Responsibilities:",https://www.dice.com/jobs/detail/Google-Cloud-Platform-%28GCP%29-Architect-TechnoSphere%2C-Inc-New-York-NY-10001/technosp/112796FC
Virtualization Engineer,"IRIS Software, Inc.","Jersey City, NJ",2 weeks ago,"Hi, This is Arpit from Iris Software. We have a position of Senior Virtualization Engineer in Jersey City, NJ. If",https://www.dice.com/jobs/detail/Virtualization-Engineer-IRIS-Software%2C-Inc.-Jersey-City-NJ-07097/irissoft/6212111
Senior Middleware Operations...,"IRIS Software, Inc.","Jersey City, NJ",1 week ago,Location: Jersey City - preferred. Open to South Lake and Omaha This is a Senior Production Support role. This is,https://www.dice.com/jobs/detail/Senior-Middleware-Operations-Engineer-IRIS-Software%2C-Inc.-Jersey-City-NJ-07097/irissoft/6342944
Infrastructure Engineer,Dimensional Thinking,"New York, New York",1 week ago,"Summary Network, Security incident monitoring and response. He/she will establish the cross-functional processes necessary to actively...",https://www.dice.com/jobs/detail/Infrastructure-Engineer-Dimensional-Thinking-New-York-New+York-10022/10226510/3146
SAP Business Objects Data Services...,Pioneer Consulting Services LLC,"New York, NY",1 week ago,"Reporting to the Associate Director, Data Integration & Analytics, the Sr. Application Systems Developer will be responsible for...",https://www.dice.com/jobs/detail/SAP-Business-Objects-Data-Services-%28BODS%29-consultants-Pioneer-Consulting-Services-LLC-New-York-NY-10001/10509003/6344097
Java / J2EE Engineer,Citadel Information Services Inc,"Woodbridge Township, NJ",1 week ago,"Separate positions available both here in NJ and in Hyderabad, India Role is contract but can be contract to hire",https://www.dice.com/jobs/detail/Java-%26%2347-J2EE-Engineer-Citadel-Information-Services-Inc-Woodbridge-Township-NJ-/10148179/EVG332211
Tibco Developer,Independent Software Inc.,"Union, NJ",1 week ago,"Tibco Developer Location: Union, NJ – LOCAL candidates only! Duration: 6 months This position will provide Administrative...",https://www.dice.com/jobs/detail/Tibco-Developer-Independent-Software-Inc.-Union-NJ-07083/isesnj/KLBB629
C# Developer ( No Third Parties),JK Partners Inc,"New York, NY",7 days ago,"BREDS : Software Developer Required technical Skills - C# 4.0+, .NET 4.5+, SQL Server 2014 (Required), LINQ, WCF , Web",https://www.dice.com/jobs/detail/C%23-Developer-%28-No-Third-Parties%29-JK-Partners-Inc-New-York-NY-10011/10379290/464250
SAP BODS,Vbeyond Corporation,"New York City, NY",7 days ago,"Job Title : SAP BODS Consultant Job Location : New York City, NY Duration : Long Term Contract Minimum Qualifications",https://www.dice.com/jobs/detail/SAP-BODS-Vbeyond-Corporation-New-York-City-NY-10001/10209652/6339160
Sr Ruby on Rails Developer,Lenmar Consulting,"Nyc, NY",7 days ago,"Sr Ruby on Rails Developer Opportunity. If interested, please contact Amita @ 201-744-2278, OR email your resume Sr Ruby on",https://www.dice.com/jobs/detail/Sr-Ruby-on-Rails-Developer-Lenmar-Consulting-Nyc-NY-06804/10116775/6053112
C# RAD Developer,Lenmar Consulting,"New York, NY",7 days ago,"Key Responsibilities Work as a business-aligned RAD developer in our Front-office Technology team, Focus on delivering the risk and...",https://www.dice.com/jobs/detail/C%23-RAD-Developer-Lenmar-Consulting-New-York-NY-10001/10116775/6339261
Systems Engineer II,Lenmar Consulting,"Parsippany-troy Hills, NJ",7 days ago,"Systems Engineer II Must have knowledge of foreign exchange/banking and market data industries As a Systems Engineer III, your day",https://www.dice.com/jobs/detail/Systems-Engineer-II-Lenmar-Consulting-Parsippany%26%2345troy-Hills-NJ-/10116775/Sys%26%2332Eng%26%2332NJMD
SQL Server Developer (.NET),The Execu|Search Group,"Secaucus, NJ",7 days ago,Position Summary: You will be part of a growing Application Development team that leads client applications for Internal and External,https://www.dice.com/jobs/detail/SQL-Server-Developer-%28.NET%29-The-Execu%7CSearch-Group-Secaucus-NJ-07094/EXECUSCH/6340754
SQL Server Developer (.Net),The Execu|Search Group,"Secaucus, NJ",7 days ago,Job Title: SQL Server Developer (.Net) Location: Northern NJ Job Type: Contract Duration: Long Term Contact Info: Bryan Luther -,https://www.dice.com/jobs/detail/SQL-Server-Developer-%28.Net%29-The-Execu%7CSearch-Group-Secaucus-NJ-07094/EXECUSCH/6316644
Information Security Engineer,The Execu|Search Group,"New York, NY",7 days ago,Job Title: Information Security Engineer (no third parties please) Location: Queens (Long Island City) Job Type: Contract Duration: 1...,https://www.dice.com/jobs/detail/Information-Security-Engineer-The-Execu%7CSearch-Group-New-York-NY-10001/EXECUSCH/NY%26%2345SecEngineer
Senior Middleware Operations...,Matlen Silver,"Jersey City, NJ",4 days ago,"Senior Middleware Operations Engineer Location: Jersey City, NJ Duration: 6+ months Responsibilities: Looking for a technology leader...",https://www.dice.com/jobs/detail/Senior-Middleware-Operations-Engineer-Matlen-Silver-Jersey-City-NJ-07097/matlennj2/6346274
Senior Network Engineer,Xoriant Corporation,"New York, NY",4 days ago,Greetings!! One of our direct clients is looking to hire a Senior Network Engineer for a 12+ Months Contract. If,https://www.dice.com/jobs/detail/Senior-Network-Engineer-Xoriant-Corporation-New-York-NY-10001/xorca001/newnetworkeng
Data Analyst,"WinInfosys, Inc","New York City, NY",4 days ago,"Title : Data Analyst Location : New York City, NY Duration : 12+ Months Start date : ASAP Key skills",https://www.dice.com/jobs/detail/Data-Analyst-WinInfosys%2C-Inc-New-York-City-NY-10001/10198066/6346676
KDB Developer,enableIT LLC,"New York, NY",4 days ago,Our major financial client in NYC is looking for a q/KDB Developer. Responsibilities: Translate business requirements into designs for...,https://www.dice.com/jobs/detail/KDB-Developer-enableIT-LLC-New-York-NY-10001/10377253/393003
