title,company,location,posted_time,description,link
SQL Server Developer(Backfill) -...,InfoPeople Corp,"Nyc, NY",3 weeks ago,"Job Title: SQL Server Developer Position Type: Contract Location: New York, NY, United States Description: MANDATORY...",https://www.dice.com/jobs/detail/SQL-Server-Developer%28Backfill%29-%26%2345-Direct-Client%3A%3A%3Aonly-NY-NJ-locals-InfoPeople-Corp-Nyc-NY-10001/10186340/6170560
Data Scientist / NLP - Fulltime...,Blue Rock Consulting,"Florham Park, NJ",1 week ago,"As a Data Scientist, you will be responsible for developing machine learning models to support product features in the roadmap.",https://www.dice.com/jobs/detail/Data-Scientist-%26%2347-NLP-%26%2345-Fulltime-%28NJ%29-Blue-Rock-Consulting-Florham-Park-NJ-07495/91012318/661796
AWS DevOps Engineer - NY or NJ w/...,"NorthBay Solutions, LLC","New York, NY",1 week ago,"About Us Would you like to be part of a team focused on helping customers in a ""once in a",https://www.dice.com/jobs/detail/AWS-DevOps-Engineer-%26%2345-NY-or-NJ-w%26%2347-up-to-70%26%2337-travel-required-NorthBay-Solutions%2C-LLC-New-York-NY-10001/91094041/142
Senior Software Developer - Hot To...,Next Step Systems,"Great Neck, NY",23 hours ago,"Senior Software Developer - Hot To Hire! ***Company has experienced significant growth, having doubled in size the last 5 years!***",https://www.dice.com/jobs/detail/Senior-Software-Developer-%26%2345-Hot-To-Hire%21-%26%2345-G-Next-Step-Systems-Great-Neck-NY-11020/NEXIL001/6325913
C++ Software Developer - Hot To...,Next Step Systems,"Great Neck, NY",23 hours ago,"C++ Software Developer - Hot To Hire! ***Company has experienced significant growth, having doubled in size the last 5 years!***",https://www.dice.com/jobs/detail/C%2B%2B-Software-Developer-%26%2345-Hot-To-Hire%21-%26%2345-R-Next-Step-Systems-Great-Neck-NY-11020/NEXIL001/6324132
Associate Software Developer -...,Next Step Systems,"Great Neck, NY",23 hours ago,"Associate Software Developer - Interview Now! Will consider entry level candidates! ***Company has experienced significant growth,...",https://www.dice.com/jobs/detail/Associate-Software-Developer-%26%2345-Interview-Now%21-%26%2345-M-Next-Step-Systems-Great-Neck-NY-11020/NEXIL001/6322257
Pre-Sales Cloud Architect (New...,Information Builders,"New York City, NY",11 hours ago,Title: Pre-Sales Cloud Architect (SA) Reporting To: VP Technical Sales Strategy and Engineering Company Description Superior customer...,https://www.dice.com/jobs/detail/Pre%26%2345Sales-Cloud-Architect-%28New-York-NY-US%29-Information-Builders-New-York-City-NY-10001/infnj001/53979266
"Software Engineer, Platform...",Gambit Technologies Inc,"New York, NY",1 day ago,Summary: An elite tech-driven hedge funds headquartered in NYC is tackling problems through experimentation and analysis - their team...,https://www.dice.com/jobs/detail/Software-Engineer%2C-Platform-Reliability-%28%24200K%2B%29-Gambit-Technologies-Inc-New-York-NY-10001/10116662/AC915094115
Devops Engineer - 2019 Quick Hire...,Gambit Technologies Inc,"New York, NY",1 day ago,Devops Engineer - 2019 Quick Hire Opportunity A highly regarded fin-tech shop in New York City is looking for skilled,https://www.dice.com/jobs/detail/Devops-Engineer-%26%2345-2019-Quick-Hire-Opportunity-Gambit-Technologies-Inc-New-York-NY-10001/10116662/JP7562171219
Senior Site Reliability Engineer -...,Gambit Technologies Inc,"New York, NY",1 day ago,Summary A rapidly growing NYC tech startup is seeking a development focused Site Reliability Engineer to promote a modern DevOps,https://www.dice.com/jobs/detail/Senior-Site-Reliability-Engineer-%26%2345-Top-NYC-Tech-Firm-%28%24200K%2B%29-Gambit-Technologies-Inc-New-York-NY-10001/10116662/AC88162269
Front-end Engineer (Angular) -...,Gambit Technologies Inc,"New York, NY",1 day ago,Summary: A NYC FinTech Firm is looking for a Front-end Angular Engineer to join their collaborative team in the greenfield,https://www.dice.com/jobs/detail/Front%26%2345end-Engineer-%28Angular%29-%26%2345-FinTech-Team-%28%24120K%2B%29-Gambit-Technologies-Inc-New-York-NY-10001/10116662/MF478980125
"Lead Cloud Software Engineer,...",Gambit Technologies Inc,"New York, NY",1 day ago,Summary: A specialized tech team within the Greater NYC area is currently building out a greenfield SaaS human analytics platform.,https://www.dice.com/jobs/detail/Lead-Cloud-Software-Engineer%2C-Greenfield-SaaS-Platform-%28%24200%26%2345300K%2B%29-Gambit-Technologies-Inc-New-York-NY-10001/10116662/EH424021416
".NET Software Dev III, ASP .NET,...","Galen Technology Solutions, Inc.","Montvale, NJ",1 day ago,"This position is located in BERGEN COUNTY, NJ OR DALLAS, TX W2 Only - No Agencies, No c2c, No sponsorships",https://www.dice.com/jobs/detail/.NET-Software-Dev-III%2C-ASP-.NET%2C-NoSQL%26%2347Spark%2CPrototypes-%28NJ%29-%26%2345-W2-Only-Galen-Technology-Solutions%2C-Inc.-Montvale-NJ-07645/galen/1572836
Web Application Developer -...,"Galen Technology Solutions, Inc.","Montvale, NJ",1 day ago,"W2 Candidates only, No 3rd parties or C2C, pleas e Position is located in Northern NJ/Bergen County NJ INTERESTERD? Please",https://www.dice.com/jobs/detail/Web-Application-Developer-%26%2345-Angular-JS%2C-Microservices-%28NJ%29-%26%2345-W2-Only-Galen-Technology-Solutions%2C-Inc.-Montvale-NJ-07645/galen/1572772
C#/VBA Developer || Locals || F2F...,Amtex Systems Inc.,"New York, NY",20 hours ago,"Key Skills: Design, develop, test, deploy, and support high quality front office applications and toolsets while working closely with...",https://www.dice.com/jobs/detail/C%23%26%2347VBA-Developer-%7C%7C-Locals-%7C%7C-F2F-%7C%7C-Financial-Background-Amtex-Systems-Inc.-New-York-NY-10001/10124954/CVBA001
Senior Backend Engineer ($200k+...,Gambit Technologies Inc,"New York, NY",1 day ago,Summary A series E global tech company in NYC that processes billions of data points monthly to allow large brands,https://www.dice.com/jobs/detail/Senior-Backend-Engineer-%28%24200k%2B-plus-equity%29-Gambit-Technologies-Inc-New-York-NY-10001/10116662/GV837623111
Senior Data Lake...,Cardinal Integrated Technologies Inc,"Nyc, NY",1 week ago,Direct Client Requirement Title: Senior Data Lake Engineer/Developer-Tech Lead Duration: 6 months CTH Location: New York Job...,https://www.dice.com/jobs/detail/Senior-Data-Lake-Engineer%26%2347Developer%26%2345Tech-Lead-Cardinal-Integrated-Technologies-Inc-Nyc-NY-10001/10121181/6254589
PostgreSQL DBA Consultant,"The Connors Group, Inc.","New York, NY",4 days ago,"You will be responsible for;: Tune top 10 long-running queries on the primary database Locate, identify, classify, and document...",https://www.dice.com/jobs/detail/PostgreSQL-DBA-Consultant-The-Connors-Group%2C-Inc.-New-York-NY-10001/10119180/7207
Big Data Engineer/Developer,"Innovative Information Technologies, Inc","New York, NY",20 hours ago,Big Data Engineer/Developer We are searching for a Big Data Engineer/Developer to add to our team on our project at,https://www.dice.com/jobs/detail/Big-Data-Engineer%26%2347Developer-Innovative-Information-Technologies%2C-Inc-New-York-NY-10001/10113363/662165
DevOps / AWS Engineer,NIC INFO TEK INC,"New York City, NY",2 weeks ago,Duties and Responsibilities: Implement and support AWS Kafka clusters Implement and support AWS-based Mongo DB instances Coordinates...,https://www.dice.com/jobs/detail/DevOps-%26%2347-AWS-Engineer-NIC-INFO-TEK-INC-New-York-City-NY-10001/10123917/6335471
Senior DevOps Engineer in...,Quintessence Computer Corp,"Edison, NJ",2 weeks ago,Lead or Senior DevOps Engineer === ONLY LOCAL CANDIDATES PLEASE === === WE ARE OPEN TO VISA TRANSFERS AND VISA,https://www.dice.com/jobs/detail/Senior-DevOps-Engineer-in-Financial-Trading-Systems-%28NO-3RD-PARTY-CANDIDATES-PLEASE%29-Quintessence-Computer-Corp-Edison-NJ-10008/quintny/DEVOPS509
Sr. Java Fullstack Developer /...,Synechron Inc.,"Weehawken, NJ",7 days ago,"About Synechron Synechron, one of the fastest-growing digital, business consulting & technology services providers, is a $500...",https://www.dice.com/jobs/detail/Sr.-Java-Fullstack-Developer-%26%2347-Lead-_-NJ-Synechron-Inc.-Weehawken-NJ-07086/10111699/6322946
SAS Data Scientist - Need GC and...,Infinity Tech Group Inc,"Jericho, NY",4 weeks ago,"Hi, Hope you are doing great. Please find the requirement below and let me know if you are interested. Role:",https://www.dice.com/jobs/detail/SAS-Data-Scientist-%26%2345-Need-GC-and-USC-Infinity-Tech-Group-Inc-Jericho-NY-11753/infnj003/SAI%26%2332SAS%26%2332DS
"Scala Developer || New York, NY ||...",Zencon Group,"New York City, NY",3 weeks ago,Description: Some of the skiil-set required for the Scala Dev role are as under: Strong knowledge of Scala programming Strong,https://www.dice.com/jobs/detail/Scala-Developer-%7C%7C-New-York%2C-NY-%7C%7C-12%2BMonths-Zencon-Group-New-York-City-NY-10001/91109447/6337217
AWS DevOps Engineer - Fixed...,CoTalent,"Newark, NJ",1 month ago,"*W2/C2C - 6+ Months Contract - Right to Hire, Those authorized to work in the United States without sponsorship are",https://www.dice.com/jobs/detail/AWS-DevOps-Engineer-%26%2345-Fixed-Income%2C-NEWARK%2C-New-Jersey-CoTalent-Newark-NJ-07101/91102393/6322267
Data Scientist - NLP - Remote !!,Microexcel,"New York, NY",1 week ago,Our Direct Client is looking for a Data Scientist with strong NLP exp Good experience in Modelling for F1 Optimization,https://www.dice.com/jobs/detail/Data-Scientist-%26%2345-NLP-%26%2345-Remote-%21%21-Microexcel-New-York-NY-10001/10206078/gs_saphana
DevOps Engineer with Kafka...,Techtriad Team - T3,"New York, NY",7 days ago,Senior DevOps Engineer 5 Penn Plaza NYC Phone/In person Interview Position Summary: Implement and support AWS-based Kafka clusters and...,https://www.dice.com/jobs/detail/DevOps-Engineer-with-Kafka-experience-%28IN-PERSON-INTERVIEW%29-Techtriad-Team-%26%2345-T3-New-York-NY-10001/90995670/NKDENY
Immediate need -Application...,Kelly IT,"Short Hills, NJ",7 days ago,"Kelly Services is seeking an Application Architect I for a leading commercial data and analytics company in Short Hills, NJ.",https://www.dice.com/jobs/detail/Immediate-need-%26%2345Application-Architect-I-%26%2345Short-Hills%2C-NJ-Kelly-IT-Short-Hills-NJ-07078/10114756a/6292960
Data Engineer with Google Cloud...,Terminal Contacts LLC,"Piscataway, NJ",1 week ago,Role: GCP Data Engineer Location: Piscataway NJ Virtusa | Amex Contract Job Roles/Responsibilities: Min 1-2 yrs of experience in...,https://www.dice.com/jobs/detail/Data-Engineer-with-Google-Cloud-Platform-%26%2345-Piscataway-NJ-Terminal-Contacts-LLC-Piscataway-NJ-08854/10480767/ANG_GCPDE
Senior KDB+/Q Developer for Top...,"Archer I.T., LLC","New York, NY",5 days ago,"Senior KDB+/Q Developer: KDB is the strategic platform for realtime analytics in our firm, across multiple front office desks. The",https://www.dice.com/jobs/detail/Senior-KDB%2B%26%2347Q-Developer-for-Top-Financial-Firm-in-NYC%21-%241000-per-day-give-or-take%21-Archer-I.T.%2C-LLC-New-York-NY-10001/10340096/6313513
backfill - Data analyst (Snowflake...,Job Cloud Inc.,"New York, NY",3 days ago,"BACKFILL position. Only 1 interview within 48 hours and they will make their decision. Position: Data analyst Location: NYC, NY",https://www.dice.com/jobs/detail/backfill-%26%2345-Data-analyst-%28Snowflake-Database%29-%26%2345-NYC%2C-NY-10011-Job-Cloud-Inc.-New-York-NY-10001/90960822/6345817
Contract Opening Role :- Senior...,Quantum World Technologies Inc.,"New York, NY",16 hours ago,"Role :- Senior BigData Engineer Location :- New York, NY Strong coding skills in Python (or scala or java) Strong",https://www.dice.com/jobs/detail/Contract-Opening-Role-%3A%26%2345-Senior-BigData-Engineer-Location-%3A%26%2345-New-York%2C-NY-Quantum-World-Technologies-Inc.-New-York-NY-10001/90999956/2019%26%23454208
"AWS Data Lead at NYC, NY/ Tampa, FL",Novateur Technologies Inc.,"Nyc, NY",18 hours ago,"AWS Data Lead Location:NYC, NY/ Tampa, FL Duration:Long Term Primary Skill Overall experience of 6-8 years in Data warehousing and",https://www.dice.com/jobs/detail/AWS-Data-Lead-at-NYC%2C-NY%26%2347-Tampa%2C-FL-Novateur-Technologies-Inc.-Nyc-NY-10001/90938793/6286095
Job Opportunity: Software...,Xoriant Corporation,"Montvale, NJ",12 hours ago,"Software Developer - .NET III Location : Montvale, NJ Phone/F2F interview. 12+ Months Contract Job Description: Duties: Coding,...",https://www.dice.com/jobs/detail/Job-Opportunity%3A-Software-Developer-%26%2345-.NET-III-%26%2347-Montvale%2C-NJ-Xoriant-Corporation-Montvale-NJ-10001/xorca001/6113972
"Senior Web Developer (SQL, REST...",iTech Solutions,"New York, NY",moments ago,"Senior Web Developer (SQL, REST APIs); NYC Or Boston; W2 only Develop specifications of extremely complex software programming...",https://www.dice.com/jobs/detail/Senior-Web-Developer-%28SQL%2C-REST-APIs%29%3B-NYC-or-Boston%3B-W2-iTech-Solutions-New-York-NY-10001/10111560/19%26%234501793
GCP Solutions Architect - Remote...,Sovereign Technologies,"New York, NY",1 week ago,"Title : GCP Solutions Architect Location : Remote position with minimal travel to San Francisco, CA, less than 10%. Duration",https://www.dice.com/jobs/detail/GCP-Solutions-Architect-%26%2345-Remote-position-%26%2345-12-Months-Sovereign-Technologies-New-York-NY-10001/10120317/6340720
Direct Client-Tibco...,Cardinal Integrated Technologies Inc,"Union, NJ",12 hours ago,"Position: TIBCO Administrator/Developer Location: Union, NJ Duration: 6+ Months Job Description: TIBCO Administrator/Developer...",https://www.dice.com/jobs/detail/Direct-Client%26%2345Tibco-Admin%26%2347Developer%26%2345F2F-Mandatory-Cardinal-Integrated-Technologies-Inc-Union-NJ-07083/10121181/6312362
Quality Assurance (QA) Tester -...,Access Staffing,"New York, NY",11 hours ago,New and exciting full-time opportunity for a QA Tester with automation testing (this is with a financial services company in,https://www.dice.com/jobs/detail/Quality-Assurance-%28QA%29-Tester-%26%2345-Great-opportunity%21-%26%2345-to-100k-%2B-bonus%21-Access-Staffing-New-York-NY-10001/accperny/SK_NYC_QA
Consultant Contractor Robotics...,Gambit Technologies Inc,"New York, NY",1 day ago,Consultant Contractor Robotics Process Engineer (RPA) for a Fortune 500 Company If you're a passionate coder with 3-5 years of,https://www.dice.com/jobs/detail/Consultant-Contractor-Robotics-Process-Engineer-%28RPA%29-for-a-Fortune-500-Company-Gambit-Technologies-Inc-New-York-NY-10001/10116662/CL8679341122
Analytics Consultant / Business...,Xinthe Technologies,"Jersey City, NJ",3 weeks ago,Analytics Consultant/ Business Analyst Location : NJ / NY / CT Start: Immediate Duration: 6 months CAN BE EXTENDED Skillsets:,https://www.dice.com/jobs/detail/Analytics-Consultant-%26%2347-Business-Analyst-%28-Locations-%26%2345-NY%26%2347-NJ%26%2347-CT%29-Xinthe-Technologies-Jersey-City-NJ-07097/10514647/6340230
DevOps Engineer,Oscar Associates Americas LLC,"Newark, NJ",6 minutes ago,"DevOps Engineer - CI/CD, Python, IAC, Terraform, Containers, Docker, Ansible & Git Newark, NJ $120,000-$140,000 The Role: ARE YOU...",https://www.dice.com/jobs/detail/DevOps-Engineer-Oscar-Associates-Americas-LLC-Newark-NJ-07102/10525742/DevOps%26%2345931
Big Data Developer,"Fortune Global Solutions, LLC","Jersey City, NJ",1 week ago,"Greetings! We have an immediate need of python developer in Chicago, IL. Please go through the below requisition and if",https://www.dice.com/jobs/detail/Big-Data-Developer-Fortune-Global-Solutions%2C-LLC-Jersey-City-NJ-07097/91001055/6249000
Senior Cloud Security Engineer,News Corp,"New York, NY",3 days ago,"Job Description: As a global media and information services company, News Corp understands the importance of data security and...",https://www.dice.com/jobs/detail/Senior-Cloud-Security-Engineer-News-Corp-New-York-NY-10036/906563BA/115833845
"Lead Software Engineer,...",Planned Parenthood Federation of America,"New York, NY",2 weeks ago,"Planned Parenthood Federation of America (PPFA) is the nation s leading women s health care provider, educator, and advocate, serving",https://www.dice.com/jobs/detail/Lead-Software-Engineer%2C-Application-Architecture-Planned-Parenthood-Federation-of-America-New-York-NY-10001/RTX1d3bbf/6333591
Sr. Java Engineer,"NTT DATA, Inc.","New York, NY",moments ago,"Title: Sr. Software Engineer - Backend Java Location: NY, NY Duration: Full-time Our client is seeking an experienced Senior Software",https://www.dice.com/jobs/detail/Sr.-Java-Engineer-NTT-DATA%2C-Inc.-New-York-NY-10001/misiny1/19%26%234513496
Cybersecurity Consultant 3 -...,AT&T,"New York, NY",3 weeks ago,AT&T Cybersecurity Consulting is a division of AT&T (a Fortune Global Top 10 company) and is looking for a senior,https://www.dice.com/jobs/detail/Cybersecurity-Consultant-3-%26%2345-Secure-Infrastructure-Services-AT%26T-New-York-NY-10001/10285903/1956081%26%23456
Senior Solutions Architect,Ness USA inc.,"Teaneck, NJ",2 weeks ago,"Total years of Experience Over 20 years in the IT industry Roles & Responsibilities Work directly with onsite teams, customers",https://www.dice.com/jobs/detail/Senior-Solutions-Architect-Ness-USA-inc.-Teaneck-NJ-07666/apar/6336884
DevOps Automation Engineer,"TSR Consulting Services, Inc.","Raleigh, NC",moments ago,"DevOps, Infrastructure and Cloud Automation Engineer Location: Raleigh NC Client: Financial Services Contract: Long Term Job...",https://www.dice.com/jobs/detail/DevOps-Automation-Engineer-TSR-Consulting-Services%2C-Inc.-Raleigh-NC-10010/tsrny/19%26%234504810
Full Stack developer - New York...,Premium Information Technology,"New York, NY",4 days ago,"Hello Greeting from Premium Information Technology Inc, Position: Full Stack Java Developer with Angular Location: New York City, NY...",https://www.dice.com/jobs/detail/Full-Stack-developer-%26%2345-New-York-City%2C-NY-Premium-Information-Technology-New-York-NY-10001/prepa001/JPC207%26%2345207
Azure Data Platform Developer,Tech Mahindra (Americas) Inc.,"Warren, NJ",3 weeks ago,Year of Exp. & Pre-Requisites o Minimum 6 years of overall IT experience o Working knowledge of Data Warehousing concepts,https://www.dice.com/jobs/detail/Azure-Data-Platform-Developer-Tech-Mahindra-%28Americas%29-Inc.-Warren-NJ-07059/10117699/6187348
DevOps Engineer,GlobalSource IT,"Piscataway, NJ",1 month ago,GlobalSourceIT is part of the Midwest s largest privately held staffing and consulting conglomerate. While we focus primarily in ERP,https://www.dice.com/jobs/detail/DevOps-Engineer-GlobalSource-IT-Piscataway-NJ-08854/argusit/6326400
Ruby on Rails engineer,Eliassen Group,"New York, NY",1 week ago,"Ruby on Rails Engineer New York, NY Pay: $50.00-$60.00 or up to $140,000.00 salary Contract: 6+ month contract to hire",https://www.dice.com/jobs/detail/Ruby-on-Rails-engineer-Eliassen-Group-New-York-NY-10001/10444409/6332689
Data Scientist,"VED Software Services, Inc.","Jersey City, NJ",4 days ago,Responsibilities: Work with business analysts and technology developers to analyze automation use cases for opportunities to leverage...,https://www.dice.com/jobs/detail/Data-Scientist-VED-Software-Services%2C-Inc.-Jersey-City-NJ-27701/vedmi001/fulltime
Business Intelligence Lead Analyst,"Brains Workgroup, Inc.","New York, NY",3 days ago,"BI (Business Intelligence) Lead Analyst One of our clients, a major Retailer, is looking for a talented Business Intelligence (BI)",https://www.dice.com/jobs/detail/Business-Intelligence-Lead-Analyst-Brains-Workgroup%2C-Inc.-New-York-NY-10001/RTL499109/BIAnalyst3
Senior Vice President of Data...,"Brains Workgroup, Inc.","Great Neck, NY",3 days ago,"Senior Vice President of Data Integration and Machine Learning One of our clients, a Global Market Research Company, is looking",https://www.dice.com/jobs/detail/Senior-Vice-President-of-Data-Integration-and-Machine-Learning-Brains-Workgroup%2C-Inc.-Great-Neck-NY-11020/RTL499109/VP%26%2345Data
SRE,Kforce Technology Staffing,"New York, NY",11 hours ago,"RESPONSIBILITIES: Kforce has a client in search of an SRE in New York, NY. Duties Include: * Evangelize best practices",https://www.dice.com/jobs/detail/SRE-Kforce-Technology-Staffing-New-York-NY-10001/kforcecx/ITAQG1865920
DevOps Engineer - Terraform,Kforce Technology Staffing,"New York, NY",11 hours ago,"RESPONSIBILITIES: Kforce is working with a growing Technology Firm located in New York, New York (NY) that is searching for",https://www.dice.com/jobs/detail/DevOps-Engineer-%26%2345-Terraform-Kforce-Technology-Staffing-New-York-NY-10121/kforcecx/ITAQG1837878
Performance Test Engineer,Custom Staffing,"Parsippany-troy Hills, NJ",2 weeks ago,Please note only on W2 GC or Those authorized to work in the United States without sponsorship are encouraged to,https://www.dice.com/jobs/detail/Performance-Test-Engineer-Custom-Staffing-Parsippany%26%2345troy-Hills-NJ-/10301087/6332054
Network Engineer,Milan Solution,"Jersey City, NJ",1 week ago,5+ years of experience with Cisco router/switch/Datacenter/VOIP products and strong analytical and troubleshooting skills. Cisco VOIP...,https://www.dice.com/jobs/detail/Network-Engineer-Milan-Solution-Jersey-City-NJ-07097/91111776/6339818
Azure Data Engineer,Paradigm Infotech,"Warren, NJ",20 hours ago,"Looking for Azure Data Engineer @ Warren, NJ Job Title : Azure Data Engineer Contract : 6-12 months Need to",https://www.dice.com/jobs/detail/Azure-Data-Engineer-Paradigm-Infotech-Warren-NJ-07059/10107189/6280367
Senior Performance Test Engineer,Kforce Technology Staffing,"Newark, NJ",11 hours ago,"RESPONSIBILITIES: Kforce is working with a growing financial services firm located in Denville, New Jersey (NJ) and they are searching",https://www.dice.com/jobs/detail/Senior-Performance-Test-Engineer-Kforce-Technology-Staffing-Newark-NJ-07834/kforcecx/ITAQG1863934
Application Architect III,Orion Business Innovations Careers,"Montvale, NJ",moments ago,Duties: Partner with other Architecture teams to develop solution designs and review alternative solutions for best fit. Strategize...,https://www.dice.com/jobs/detail/Application-Architect-III-Orion-Business-Innovations-Careers-Montvale-NJ-07645/10334542a/19%26%234501841
Site Reliability Engineer,"TSR Consulting Services, Inc.","New York, NY",moments ago,Title: Site Reliability Engineer Location: NYC W2 ONLY Online Publisher is looking for a proactive Site Reliability Engineer who...,https://www.dice.com/jobs/detail/Site-Reliability-Engineer-TSR-Consulting-Services%2C-Inc.-New-York-NY-10014/tsrnj/19%26%234504778
Security Architect - Splunk,QED National,"Jersey City, NJ",6 minutes ago,"A NYS agency located in New York, NY is looking for a Security Architect - Splunk for a 12 month",https://www.dice.com/jobs/detail/Security-Architect-%26%2345-Splunk-QED-National-Jersey-City-NJ-07304/qed/BBBH11403%26%2345401
DevOps/Site Reliability Engineer -...,Atlantic Partners,"New York, NY",7 days ago,Our client is looking for a proactive Site Reliability Engineer who shares our passion for technology and innovation. The right,https://www.dice.com/jobs/detail/DevOps%26%2347Site-Reliability-Engineer-%26%2345-C2H-Atlantic-Partners-New-York-NY-10001/10124549/JS%26%2345SiteRel%26%2345NYC
Cloud DevOPS Architect,IGT Solutions Inc,"Nyc, NY",3 days ago,Position:- Senior Devops Engineer Salary: DOE 12 months renewable/FTE Job Location: Dubai Creates and maintains fully automated CI/CD...,https://www.dice.com/jobs/detail/Cloud-DevOPS-Architect-IGT-Solutions-Inc-Nyc-NY-30301/91098949/6261225
"Devops engineer - Piscataway, NJ",Virtusa,"Piscataway, NJ",2 weeks ago,"Git, Bitbucket, Teamcity, uDeploy, RTC, WebSphere, BuildForge, Powershell and Python Script Have problem solving attitude Good...",https://www.dice.com/jobs/detail/Devops-engineer-%26%2345-Piscataway%2C-NJ-Virtusa-Piscataway-NJ-60290/10115393/6167648
Informatica Data Quality Developer...,"DVI Technologies, Inc.","Nyc, NY",3 weeks ago,Role- Informatica Data Quality Developer / IDQ Developer Location: NYC Duration: 6 months Informatica Data Quality Development for the...,https://www.dice.com/jobs/detail/Informatica-Data-Quality-Developer-%26%2347-IDQ-Developer-DVI-Technologies%2C-Inc.-Nyc-NY-10001/10180535/6322716
Middleware DevOps Engineer -...,Contech Systems Online,"Newark, NJ",1 week ago,"CSI is accepting resumes for the following opportunity. If interested, please forward your resume and contact information and we will",https://www.dice.com/jobs/detail/Middleware-DevOps-Engineer-%26%2345-contract-to-hire-%28Newark%2C-NJ%29-Contech-Systems-Online-Newark-NJ-07102/10107170/19%26%234500808
Direct Client-Senior Data Engineer,Cardinal Integrated Technologies Inc,"Secaucus, NJ",19 hours ago,"Send your resume for immediate consideration with availability, contact and rate details to Mohd.Suhaib@cardinaltsinc.net Title:...",https://www.dice.com/jobs/detail/Direct-Client%26%2345Senior-Data-Engineer-Cardinal-Integrated-Technologies-Inc-Secaucus-NJ-07094/10121181/6214665
Urgently required Statistical...,"Binding Minds, Inc.","Roseland, NJ",1 day ago,"Title: Statistical Analyst/ Quant Analyst Duration: Long Term Interview: Phone and In-Person Location: Roseland, NJ Conduct rigorous,...",https://www.dice.com/jobs/detail/Urgently-required-Statistical-Analyst%26%2347-Quant-Analyst-in-Roseland%2C-NJ-Binding-Minds%2C-Inc.-Roseland-NJ-07068/91094149/2019%26%23452183
Hadoop Big Data Software Engineer,JPMorgan Chase & Co.,"Jersey City, NJ",5 hours ago,"Senior, hands-on development who is passionate about technology and has experience developing systems built using Big Data tools; is a",https://www.dice.com/jobs/detail/Hadoop-Big-Data-Software-Engineer-JPMorgan-Chase-%26-Co.-Jersey-City-NJ-07310/10125746/190060780
