title,company,location,posted_time,description,link
Solutions Architect,CyberCoders,"New York, NY",2 days ago,"Minimum Required Skills: HTTP, API, Node.js, Java, Python, API Integration, Finance If you are a Solutions Architect with experience,...",https://www.dice.com/jobs/detail/Solutions-Architect-CyberCoders-New-York-NY-10001/cybercod/SF2%26%23451562051102
ETL Developer,Infinity Consulting Solutions,Newark,11 hours ago,"Job Description - ETL Developer R esponsibilities Analyze requirements then design & develop applications to meet business needs,...",https://www.dice.com/jobs/detail/ETL-Developer-Infinity-Consulting-Solutions-Newark--07101/10143403/19%26%234507305
Data Architect,Infinity Consulting Solutions,"New York, NY",11 hours ago,Job Description - Data Architect Our client is a Not for profit company that is rapidly growing as a leader,https://www.dice.com/jobs/detail/Data-Architect-Infinity-Consulting-Solutions-New-York-NY-10001/10143403/19%26%234507335
Devops Analyst,MDMS Recruiting,"New York, NY",11 hours ago,"Devops Analyst Location: New York, NY Duration: 6 months to hire JOB DESCRIPTION My Direct client is seeking a devops",https://www.dice.com/jobs/detail/Devops-Analyst-MDMS-Recruiting-New-York-NY-10001/10501841/MS%26%23452295
Real World Evidence...,Kelly IT,"Parsippany, NJ",11 hours ago,Kelly Services' Outsourcing & Consulting Group has an opening for a Real World Evidence Analyst/Programmer in Pharmaceutical...,https://www.dice.com/jobs/detail/Real-World-Evidence-Analyst%26%2347Programmer-Kelly-IT-Parsippany-NJ-07005/10216736/US41JYSH_BH1652799
BI Consulting - SAP BW/SAP...,Recruit Professional Services,"Hackensack, NJ",10 hours ago,BI consulting position to help switch an existing data warehouse data feeds to SAP feeds (from S4/Hana and iDOC). Rate,https://www.dice.com/jobs/detail/BI-Consulting-%26%2345-SAP-BW%26%2347SAP-BI%26%2347SQL%26%2347SSIS-Recruit-Professional-Services-Hackensack-NJ-07643/90764204/395
Digital Systems Support Analyst,Recruit Professional Services,"Hackensack, NJ",10 hours ago,"Digital Systems Support Analyst Under direction of the Manager, Digital Transformation, the Digital Services Support Analyst will be...",https://www.dice.com/jobs/detail/Digital-Systems-Support-Analyst-Recruit-Professional-Services-Hackensack-NJ-07601/90764204/405
BI - SQL/SSRS/SSIS/SAP Developer,Recruit Professional Services,"Little Ferry, NJ",10 hours ago,2 Positions SQL Server SSIS Data Profiling Data Extraction from SAP Nice to Have Python and SAP IDOC #RecruitPS,https://www.dice.com/jobs/detail/BI-%26%2345-SQL%26%2347SSRS%26%2347SSIS%26%2347SAP-Developer-Recruit-Professional-Services-Little-Ferry-NJ-07643/90764204/356
Software Engineer (Cloud),Information Builders,"New York City, NY",11 hours ago,"We are looking for a Software Engineer to work on our recently launched, Information Builders Cloud. As a Software Engineer,",https://www.dice.com/jobs/detail/Software-Engineer-%28Cloud%29-Information-Builders-New-York-City-NY-10001/infnj001/697167487
BI Consulting - SAP BW/SAP...,Recruit Professional Services,"Hackensack, NJ",10 hours ago,BI consulting position to help switch an existing data warehouse data feeds to SAP feeds (from S4/Hana and iDOC). Rate,https://www.dice.com/jobs/detail/BI-Consulting-%26%2345-SAP-BW%26%2347SAP-BI%26%2347SQL%26%2347SSIS-Recruit-Professional-Services-Hackensack-NJ-07643/90764204/395
Digital Systems Support Analyst,Recruit Professional Services,"Hackensack, NJ",10 hours ago,"Digital Systems Support Analyst Under direction of the Manager, Digital Transformation, the Digital Services Support Analyst will be...",https://www.dice.com/jobs/detail/Digital-Systems-Support-Analyst-Recruit-Professional-Services-Hackensack-NJ-07601/90764204/405
IT Software/Application Developer...,"The Judge Group, Inc.","Morris, NJ",9 hours ago,"Location: Morris, NJ Salary: competitive Description: Our client is currently seeking an IT Software/Application Developer (646202) -...",https://www.dice.com/jobs/detail/IT-Software%26%2347Application-Developer-%28646202%29-%26%2345-FTE-The-Judge-Group%2C-Inc.-Morris-NJ-07950/cxjudgpa/646202
Infrastructure Engineer,iTech Solutions,"Greenwich, CT",moments ago,"Infrastructure Engineer - Full 100% Healthcare ! Job Description and Responsibilities In order to serve our growing customer base, we",https://www.dice.com/jobs/detail/Infrastructure-Engineer-iTech-Solutions-Greenwich-CT-06830/10111560/19%26%234501783
Technical Solutions Specialist III,"The Judge Group, Inc.","New York City, NY",9 hours ago,"Location: New York City, NY Description: Our client is currently seeking a Technical Solutions Specialist III for New York, NY",https://www.dice.com/jobs/detail/Technical-Solutions-Specialist-III-The-Judge-Group%2C-Inc.-New-York-City-NY-10001/cxjudgpa/641998
Security Engineer,"Mitchell Martin, Inc.","New York, NY",9 hours ago,"Our Client, a transglobal organization who provid es IT support, helpdesk and consultancy services , is seeking a Security Engineer",https://www.dice.com/jobs/detail/Security-Engineer-Mitchell-Martin%2C-Inc.-New-York-NY-10001/mitchmar1/124672
Software Engineer,"Mitchell Martin, Inc.","New York, NY",9 hours ago,"Our Client, an American company that empowers restaurants to own their presence, profits, and relationships, directly through their...",https://www.dice.com/jobs/detail/Software-Engineer-Mitchell-Martin%2C-Inc.-New-York-NY-10012/mitchmar1/124699
Senior RPA Development Engineer...,"The Judge Group, Inc.","Short Hills, NJ",9 hours ago,"Location: Short Hills, NJ Salary: Competitive Description: Our client is currently seeking a Senior RPA Development Engineer (640892)...",https://www.dice.com/jobs/detail/Senior-RPA-Development-Engineer-%28640892%29-The-Judge-Group%2C-Inc.-Short-Hills-NJ-07078/cxjudgpa/640892
Senior Data Developer,"The Judge Group, Inc.","Parsippany-troy Hills, NJ",9 hours ago,"Location: Parsippany-Troy Hills, NJ Salary: DOE Description: Our client is currently seeking a Senior Data Developer for a...",https://www.dice.com/jobs/detail/Senior-Data-Developer-The-Judge-Group%2C-Inc.-Parsippany%26%2345troy-Hills-NJ-07054/cxjudgpa/646065
Solution Architect,"Mitchell Martin, Inc.","Iselin, NJ",9 hours ago,"Our client, a financial services company, is seeking a Solution Architect. Location: Iselin NJ Position Type: Contract Summary of Work",https://www.dice.com/jobs/detail/Solution-Architect-Mitchell-Martin%2C-Inc.-Iselin-NJ-08830/mitchmar1/124587
Java / Web Developer,Solomon Page,"New York, NY",9 hours ago,Opportunity to join a great development team! Infrastructure Development is globally responsible for the design and development of...,https://www.dice.com/jobs/detail/Java-%26%2347-Web-Developer-Solomon-Page-New-York-NY-10019/solopft/129483
Site Reliability Engineer,Solomon Page,"New York, NY",9 hours ago,"Site Reliability Engineer opportunity with highly innovative technology company. Join a small, fast-paced, growing team....",https://www.dice.com/jobs/detail/Site-Reliability-Engineer-Solomon-Page-New-York-NY-10001/solopft/130325
Machine Learning / Artificial...,Solomon Page,"Hoboken, NJ",9 hours ago,Our client a Major Management Consulting firm is seeking a Machine Learning/Artificial Intelligence engineer that can assist building...,https://www.dice.com/jobs/detail/Machine-Learning-%26%2347-Artificial-Intelligence-Engineer-Solomon-Page-Hoboken-NJ-07030/solopft/129779
Backend Software Engineer...,Solomon Page,"New York, NY",9 hours ago,"Opportunity to work on new e-commerce Platform. As a software engineer on the e-commerce team, you will work on a",https://www.dice.com/jobs/detail/Backend-Software-Engineer-E%26%2345Commerce-Solomon-Page-New-York-NY-10001/solopft/130314
Cloud Solutions/Sales Engineer,Taos,"New York, NY",9 hours ago,"New York, NY Apply Now NO THIRD-PARTY VENDORS Taos is immediately hiring a Cloud Solution/Sales Engineer to join our Sales",https://www.dice.com/jobs/detail/Cloud-Solutions%26%2347Sales-Engineer-Taos-New-York-NY-10001/taosca/RgoeDaRoeV3Y
Solutions Engineer,Solomon Page,"New York, NY",9 hours ago,"Our client, a fast-growing and well-funded start-up in NYC, is looking for a Solutions Engineer to join their Customer Success",https://www.dice.com/jobs/detail/Solutions-Engineer-Solomon-Page-New-York-NY-10016/solopft/127981
Data Management analyst,Collabera,"New York, NY",9 hours ago,"New York, New York Skills : SAS,Strong Macro ,SQL,Teradata,R/Python Description : Job Title - Data Management Analyst Minimum...",https://www.dice.com/jobs/detail/Data-Management-analyst-Collabera-New-York-NY-11101/gciow/225148
Yield & Optimization Analyst,"Mitchell Martin, Inc.","New York, NY",9 hours ago,"Our client, a multinational mass media corporation, is seeking a Yield & Optimization Analyst. Location: New York NY Position...",https://www.dice.com/jobs/detail/Yield-%26-Optimization-Analyst-Mitchell-Martin%2C-Inc.-New-York-NY-10036/mitchmar1/124607
Security Engineer,"Mitchell Martin, Inc.","New York, NY",9 hours ago,"Our Client, a US human resources software company, is seeking a Security Engineer . Location: New York, NY Position Type:",https://www.dice.com/jobs/detail/Security-Engineer-Mitchell-Martin%2C-Inc.-New-York-NY-10007/mitchmar1/124551
Lead Data Scientist,CSI Tech Inc.,"Parsippany, NJ",9 hours ago,"Title: Lead Data Scientist Location: Parsippany,NJ Duration: 12mo + Contract Job Summary: The Data Scientist will be working in the",https://www.dice.com/jobs/detail/Lead-Data-Scientist-CSI-Tech-Inc.-Parsippany-NJ-07097/10113246/44509
"EDP Design & Controls Architect,...",MUFG,"Jersey City, NJ",4 days ago,"Do you want your voice heard and your actions to count? Discover your opportunity with Mitsubishi UFJ Financial Group (MUFG),",https://www.dice.com/jobs/detail/EDP-Design-%26-Controls-Architect%2C-Vice-President-MUFG-Jersey-City-NJ-07097/rippblok/10031626%26%2345WD
Enterprise Data Quality & Controls...,MUFG,"Jersey City, NJ",4 days ago,"Do you want your voice heard and your actions to count? Discover your opportunity with Mitsubishi UFJ Financial Group (MUFG),",https://www.dice.com/jobs/detail/Enterprise-Data-Quality-%26-Controls-Engineer%2C-Assistant-Vice-President-MUFG-Jersey-City-NJ-07097/rippblok/10031627%26%2345WD
Computer Vision Software Engineer,Robert Half Technology,"Teaneck, NJ",9 hours ago,"Description Major Duties/Responsibilities: Software and algorithm development using 3D computer vision, image processing, machine...",https://www.dice.com/jobs/detail/Computer-Vision-Software-Engineer-Robert-Half-Technology-Teaneck-NJ-07666/rhalfint/02710%26%23450011196847
Java Application Developer (NOSQL...,BlackRock,"New York, NY",31 minutes ago,Description About this role We're looking for the brightest engineering minds to solve the world's most complex financial challenges....,https://www.dice.com/jobs/detail/Java-Application-Developer-%28NOSQL-%26%2347J2EE-%26%2347-Spring-%26%2347-JavaScript-%26%2347-HTML%29-BlackRock-New-York-NY-10055/appblok/5221_R190763
Senior DevOps Engineer,BlackRock,"New York, NY",31 minutes ago,"Description About this role Team Overview: Data is at the core of the Aladdin platform, and increasingly, our ability to",https://www.dice.com/jobs/detail/Senior-DevOps-Engineer-BlackRock-New-York-NY-10055/appblok/5221_R190927
Senior Machine Learning Engineer,ADP,"New York, NY",15 minutes ago,Senior Machine Learning Engineer Summary We are looking for an incredibly bright Senior Machine Learning Engineer to join our growing,https://www.dice.com/jobs/detail/Senior-Machine-Learning-Engineer-ADP-New-York-NY-10261/appblok/6170_10475479
Software Development Engineer -...,Freddie Mac,"New York, NY",30 minutes ago,Are you first and foremost a Web developer using Java? Do you excel in test automation (especially Selenium) in an,https://www.dice.com/jobs/detail/Software-Development-Engineer-%26%2345-Investments-%26-Capital-Markets-Freddie-Mac-New-York-NY-10168/appblok/1067_12580BR
Cloud Data Engineer,Humana,"Stamford, CT",13 minutes ago,Description The Cloud Data Engineer at Edge will have the chance to influence decisions of a brand new organization. We,https://www.dice.com/jobs/detail/Cloud-Data-Engineer-Humana-Stamford-CT-06925/appblok/6385_218108
Lead Infrastructure Engineer,ADP,"Roseland, NJ",3 days ago,Design Engineer IV//Sr. Storage Administrator -- VMAX /Cisco MDS/Python QUALIFICATIONS REQUIRED: 10+ years of experience in IT...,https://www.dice.com/jobs/detail/Lead-Infrastructure-Engineer-ADP-Roseland-NJ-07068/appblok/6170_10545571
Sr Infrastructure Engineer,ADP,"New York, NY",12 minutes ago,"What is WorkMarket? WorkMarket, an ADP company, provides a cloud-based Freelance Management System (FMS) that is used by today's...",https://www.dice.com/jobs/detail/Sr-Infrastructure-Engineer-ADP-New-York-NY-10261/appblok/6170_10492417
IT Trading Developer,Genesis10,"New York, NY",1 day ago,Genesis10 is seeking an IT Trading Developer for a direct hire position with a financial services client located in New,https://www.dice.com/jobs/detail/IT-Trading-Developer-Genesis10-New-York-NY-10001/gentx001/19%26%234508658
Director of Cyber Security...,ADP,"Roseland, NJ",14 minutes ago,Director Cyber Security Engineering Unlock Your Career Potential: Global Security Organization at ADP. Do you have a passion for going,https://www.dice.com/jobs/detail/Director-of-Cyber-Security-Engineering-ADP-Roseland-NJ-07068/appblok/6170_10465102
Design Engineer IV-6B254H,ADP,"Roseland, NJ",12 minutes ago,"POSITION SUMMARY (Design Engineer IV) Design Engineer IV is a role that relentlessly engineers, simplifies, and automates solutions...",https://www.dice.com/jobs/detail/Design-Engineer-IV%26%23456B254H-ADP-Roseland-NJ-07068/appblok/6170_10515789
Dev Ops,"CGI Group, Inc.","New York, NY",33 minutes ago,Meet our professionals CGI: An employer of choice Position Description: The Primary activities for this Dev OPS positon is to,https://www.dice.com/jobs/detail/Dev-Ops-CGI-Group%2C-Inc.-New-York-NY-10007/appblok/2185_J1219%26%23450953
QA Test Engineer w/ Automation,Genesis10,"New York, NY",1 day ago,Genesis10 is seeking a QA Test Engineer w/ Automation for a direct hire position with a financial services client located,https://www.dice.com/jobs/detail/QA-Test-Engineer-w%26%2347-Automation-Genesis10-New-York-NY-10001/gentx001/19%26%234508496
Sr. Lead Release Engineer,Aegistech Inc.,"New York, NY",1 day ago,"Job Description: The Release Engineering team is responsible for engineering automation solutions for application, database code...",https://www.dice.com/jobs/detail/Sr.-Lead-Release-Engineer-Aegistech-Inc.-New-York-NY-10001/aegisoft/17496
DEVOPS ENGINEER - BUSINESS...,"RCM Technologies, Inc","Parsippany, NJ",1 day ago,Job Description Our client is a major Pharmaceutical company looking to bring aboard talent. DEVOPS ENGINEER - BUSINESS AUTOMATION...,https://www.dice.com/jobs/detail/DEVOPS-ENGINEER-%26%2345-BUSINESS-AUTOMATION-SPECIALIST-RCM-Technologies%2C-Inc-Parsippany-NJ-07054/cxrcmfa/19%26%234500994
DATA ENGINEER - SALES AND...,"RCM Technologies, Inc","Parsippany, NJ",1 day ago,Job Description Our client is a major Pharmaceutical company looking to bring aboard talent. This position for a Data Engineer,https://www.dice.com/jobs/detail/DATA-ENGINEER-%26%2345-SALES-AND-MARKETING-DATA-SPECIALIST-RCM-Technologies%2C-Inc-Parsippany-NJ-07054/cxrcmfa/19%26%234500990
Oracle PL/SQL Software Developer,Leidos,"New York, NY",13 minutes ago,Description Job Description: The Defense Group at Leidos has an opening for an Oracle PL/SQL Software Developer to work in,https://www.dice.com/jobs/detail/Oracle-PL%26%2347SQL-Software-Developer-Leidos-New-York-NY-10036/appblok/7021_R%26%234500023181%26%2345OTHLOC%26%2345PL%26%23452D1993
Oracle Application Data Modeler /...,Leidos,"New York, NY",13 minutes ago,Description Job Description: The Defense Group at Leidos has an opening for an Oracle Application Data Modeler/Software Developer open...,https://www.dice.com/jobs/detail/Oracle-Application-Data-Modeler-%26%2347-Software-Developer-Leidos-New-York-NY-10036/appblok/7021_R%26%234500020208%26%2345OTHLOC%26%2345PL%26%23452D1993
Technical Manager (Real-Time...,"ConsultNet, LLC","New York, NY",1 day ago,"Technical Manager (Real-Time Messaging Trading Platform) Location: New York, NY Start Date: Nov 18, 2019 Apply Now Sign Up For",https://www.dice.com/jobs/detail/Technical-Manager-%28Real%26%2345Time-Messaging-Trading-Platform%29-ConsultNet%2C-LLC-New-York-NY-10001/cxcnetut/19%26%234502330
Tableau Administrator,Useready,"New York, NY",moments ago,Create and manage Tableau Server Sites. Performance tuning using tools from Tableau and third parties. Establish and manage...,https://www.dice.com/jobs/detail/Tableau-Administrator-Useready-New-York-NY-10008/designnj1/BBBH16564%26%2345221
"Director of Data Science, Analytics",Harvey Nash Inc.,"New York, NY",1 day ago,Management Responsibilities Meet with business stakeholders to flush out use cases and key requirements Collaborate with data &...,https://www.dice.com/jobs/detail/Director-of-Data-Science%2C-Analytics-Harvey-Nash-Inc.-New-York-NY-10022/esi/1307%26%23451
Reliability Engineer (200-300K+),Gambit Technologies Inc,"New York, NY",1 day ago,Summary: A top quant hedge fund is looking for an Infrastructure Engineer/SRE to join their Production Engineering division to help,https://www.dice.com/jobs/detail/Reliability-Engineer-%28200%26%2345300K%2B%29-Gambit-Technologies-Inc-New-York-NY-10001/10116662/EH243440514
Full-stack JavaScript Engineer -...,Gambit Technologies Inc,"New York, NY",1 day ago,Full-stack JavaScript Engineer - Tech Driven Hedge Fund (150K+) Full-stack JavaScript Engineer is needed to join specialized team at...,https://www.dice.com/jobs/detail/Full%26%2345stack-JavaScript-Engineer-%26%2345-Tech-Driven-Hedge-Fund-%28150K%2B%29-Gambit-Technologies-Inc-New-York-NY-10001/10116662/MF112242420
Principal Performance Test Engineer,ADP,"Parsippany, NJ",4 days ago,ADP's DataCloud is searching for a senior and hands-on Performance Test Engineer to join our high-performance Application Development...,https://www.dice.com/jobs/detail/Principal-Performance-Test-Engineer-ADP-Parsippany-NJ-07054/appblok/6170_10440983
Design Engineer IV-6B254H,ADP,"Roseland, NJ",11 minutes ago,"POSITION SUMMARY (Design Engineer IV) Design Engineer IV is a role that relentlessly engineers, simplifies, and automates solutions...",https://www.dice.com/jobs/detail/Design-Engineer-IV%26%23456B254H-ADP-Roseland-NJ-07068/appblok/6170_10515790
Senior Cloud Architect,Gambit Technologies Inc,"New York, NY",1 day ago,Summary One of the most successful and tech-driven hedge funds in the world is seeking a senior Windows platform architect,https://www.dice.com/jobs/detail/Senior-Cloud-Architect-Gambit-Technologies-Inc-New-York-NY-10001/10116662/AC5033951120
Systems Engineer (150K+),Gambit Technologies Inc,"New York, NY",1 day ago,Summary: A globally recognized quantitative investment firm based in the heart of New York City is looking for passionate...,https://www.dice.com/jobs/detail/Systems-Engineer-%28150K%2B%29-Gambit-Technologies-Inc-New-York-NY-10001/10116662/EH69794510
Data Engineer (PySpark),Harvey Nash Inc.,"Yonkers, NY",1 day ago,"Qualifications Include Master's degree in Computer Science or related fields with three years of relevant experience, or Bachelor's...",https://www.dice.com/jobs/detail/Data-Engineer-%28PySpark%29-Harvey-Nash-Inc.-Yonkers-NY-10703/esi/1494%26%23451
Junior Azure Cloud/ Linux Engineer,Harvey Nash Inc.,"New York, NY",1 day ago,"In this role, you will: Manage and secure Linux-based cloud systems and networks at scale. Work with tools to automate",https://www.dice.com/jobs/detail/Junior-Azure-Cloud%26%2347-Linux-Engineer-Harvey-Nash-Inc.-New-York-NY-10014/esi/1495%26%23451
Engineering Manager / Team Lead -...,Gambit Technologies Inc,"New York, NY",1 day ago,Summary: An established NYC startup that is leveraging open source technologies and taking a data driven approach to humanizing...,https://www.dice.com/jobs/detail/Engineering-Manager-%26%2347-Team-Lead-%26%2345-Tech-Startup-%28200K%2B%29-Gambit-Technologies-Inc-New-York-NY-10001/10116662/MF71617745
Senior Software Engineer (Big Data),Harvey Nash Inc.,"Yonkers, NY",1 day ago,"Key Responsibilities: Design, develop, implement, and test software modules and other technology components for consumerreports.org...",https://www.dice.com/jobs/detail/Senior-Software-Engineer-%28Big-Data%29-Harvey-Nash-Inc.-Yonkers-NY-10703/esi/1405%26%23451
Sytems Engineer/Support,"ConsultNet, LLC","New York, NY",1 day ago,"Sytems Engineer/Support Location: New York, NY Start Date: Oct 29, 2019 Apply Now Sign Up For Job Alerts Email Job",https://www.dice.com/jobs/detail/Sytems-Engineer%26%2347Support-ConsultNet%2C-LLC-New-York-NY-10001/cxcnetut/19%26%234502176
Reliability/Devops Engineer...,Gambit Technologies Inc,"New York, NY",1 day ago,Reliability/Devops Engineer (150-250k) A tech focused hedge fund in NYC is looking to bring on new reliability engineers responsible...,https://www.dice.com/jobs/detail/Reliability%26%2347Devops-Engineer-%28150%26%2345250k%29-Gambit-Technologies-Inc-New-York-NY-10001/10116662/JP279953625
"Senior Manager, IT - US Audit",Genesis10,"New York, NY",1 day ago,"Genesis10 is seeking a Senior Manager, IT - US Audit for a direct hire position with a financial services client",https://www.dice.com/jobs/detail/Senior-Manager%2C-IT-%26%2345-US-Audit-Genesis10-New-York-NY-10001/gentx001/19%26%234508852
Devops Engineer (150-250k),Gambit Technologies Inc,"New York, NY",1 day ago,Devops Engineer (150-250k) SUMMARY: Quant hedge fund is looking for a talented DevOps Engineer that will be responsible for Continuous,https://www.dice.com/jobs/detail/Devops-Engineer-%28150%26%2345250k%29-Gambit-Technologies-Inc-New-York-NY-10001/10116662/JS758584222
System/Desktop Support Engineer...,Gambit Technologies Inc,"New York, NY",1 day ago,System/Desktop Support Engineer (100k+) Summary: A tech focused hedge fund in NYC is looking to add a desktop support engineer,https://www.dice.com/jobs/detail/System%26%2347Desktop-Support-Engineer-%28100k%2B%29-Gambit-Technologies-Inc-New-York-NY-10001/10116662/JS4747586227
Sr. JavaScript Developer,Gambit Technologies Inc,"New York, NY",1 day ago,Sr. JavaScript Developer - $200K+ A world-leading New York software company is looking for a Senior front-end JavaScript developer to,https://www.dice.com/jobs/detail/Sr.-JavaScript-Developer-Gambit-Technologies-Inc-New-York-NY-10001/10116662/MF88344330
Junior System Reliability Engineer,Gambit Technologies Inc,"New York, NY",1 day ago,"Junior System Reliability Engineer (New York or Connecticut, up to $140K) Summary: Elite technology focused hedge fund is looking for",https://www.dice.com/jobs/detail/Junior-System-Reliability-Engineer-Gambit-Technologies-Inc-New-York-NY-10001/10116662/JP463518524
Angular Full-Stack Developer,"ConsultNet, LLC","New York, NY",1 day ago,"Angular Full-Stack Developer Location: New York, NY Start Date: Nov 12, 2019 Apply Now Sign Up For Job Alerts Email",https://www.dice.com/jobs/detail/Angular-Full%26%2345Stack-Developer-ConsultNet%2C-LLC-New-York-NY-10001/cxcnetut/19%26%234502268
Big Data / ETL Developer,Harvey Nash Inc.,"Newark, NJ",1 day ago,"JOB TITLE: Big Data / ETL Developer Location: Newark, NJ JOB DESCRIPTION: Responsibilities Analyze requirements then design &...",https://www.dice.com/jobs/detail/Big-Data-%26%2347-ETL-Developer-Harvey-Nash-Inc.-Newark-NJ-07101/esi/1585%26%23451
Infrastructure Engineer (200-300K+),Gambit Technologies Inc,"New York, NY",1 day ago,Summary: A highly tech-focused quant hedge fund in NYC is looking to bring on a senior infrastructure engineer to help,https://www.dice.com/jobs/detail/Infrastructure-Engineer-%28200%26%2345300K%2B%29-Gambit-Technologies-Inc-New-York-NY-10001/10116662/AC683620514
Artificial Intelligence Engineer,Citadel Information Services Inc,"Woodbridge Township, NJ",3 weeks ago,"Multiple roles both here in NJ and in Hyderabad, India Job Description: We are looking to add an Artificial Intelligence",https://www.dice.com/jobs/detail/Artificial-Intelligence-Engineer-Citadel-Information-Services-Inc-Woodbridge-Township-NJ-/10148179/OR44665
Test Automation Developer,Quintrix Solutions,"New York, NY",3 weeks ago,Quintrix is on the lookout for developers who are open to upskill to the exciting world of Test Automation. Test,https://www.dice.com/jobs/detail/Test-Automation-Developer-Quintrix-Solutions-New-York-NY-10001/10503654/PR0001
Entry Level Software Developer,Quintrix Solutions,"New York, NY",3 weeks ago,***Only candidates who do not need sponsorship may apply** Training & Placement Opportunity for Junior Developers (Test Automation...,https://www.dice.com/jobs/detail/Entry-Level-Software-Developer-Quintrix-Solutions-New-York-NY-10001/10503654/QA123
Application Security Solution...,Digitalware,"New York, NY",1 month ago,"DIGITALWARE, INC. OVERVIEW Digitalware is a professional consulting, managed security services and product development company...",https://www.dice.com/jobs/detail/Application-Security-Solution-Architect-Digitalware-New-York-NY-10001/10380675/6309345
Java Developer,United Business Solutions Inc,"New York City, NY",1 week ago,Role: Java Developer Location: NYC Job Type: Full Time Interview Mode: Phone & In-person Responsibilities: Strong experience of...,https://www.dice.com/jobs/detail/Java-Developer-United-Business-Solutions-Inc-New-York-City-NY-10001/10493171/6299346
Data Scientist,"M-Logic, Inc.","New York, NY",1 week ago,"Global, independent financial analytics, technology and services firm is looking for a Data Scientist to work closely with product...",https://www.dice.com/jobs/detail/Data-Scientist-M%26%2345Logic%2C-Inc.-New-York-NY-10001/MLOGIC/6341896
